Column1,Column2
How Do You Get from Copenhagen to Aarhus?,https://www.tripsavvy.com/how-to-get-from-copenhagen-to-aarhus-1626272
"Nightlife Options in Aarhus, Denmark",https://www.tripsavvy.com/nightlife-in-aarhus-1626188
Cruise the Baltic on a Love Boat Fit for a Princess,https://www.tripsavvy.com/royal-princess-baltic-cruise-991380
The 14 Best Day Trips From Copenhagen,https://www.tripsavvy.com/best-day-trips-from-copenhagen-1626102
Learn About Traveling With the Vikings in Scandinavia,https://www.tripsavvy.com/traveling-with-the-vikings-in-scandinavia-1626325
The Best Cities to Visit in Denmark,https://www.tripsavvy.com/best-cities-in-denmark-1626215
Denmark's Best Sights and Attractions,https://www.tripsavvy.com/best-sights-and-attractions-in-denmark-1626220
Denmark is One of the Safest Countries in the World,https://www.tripsavvy.com/safety-in-denmark-1626219
What and Where is Jutland?,https://www.tripsavvy.com/what-and-where-is-jutland-1626174
The Top 24 Things to Do in Denmark During the Winter,https://www.tripsavvy.com/things-to-do-in-denmark-during-winter-4175831
Maps of Scandinavia,https://www.tripsavvy.com/maps-of-scandinavia-4123452
You Won't Believe the Preferred Meat in This European City,https://www.tripsavvy.com/europes-surprising-culinary-capitals-3498964
