Column1,Column2
"Visit these Chic Attractions in Avignon, France",https://www.tripsavvy.com/top-attractions-in-avignon-1517711
Cruising Burgundy and Provence With Viking Cruises,https://www.tripsavvy.com/viking-river-cruises-southern-france-itinerary-993309
Top 20 Most Popular French Cities for International Visitors,https://www.tripsavvy.com/popular-french-cities-for-visitors-1517438
Want to know the top festivals in Provence this summer? Check them here,https://www.tripsavvy.com/summer-events-and-festivals-in-provence-1517818
"The 10 Best Things to Do in Provence, France",https://www.tripsavvy.com/top-attractions-provence-verdon-gorge-to-nimes-1517835
"Explore Provence, One of France's Most Beloved Territories",https://www.tripsavvy.com/provence-map-and-illustrated-travel-guide-1508843
Antique hunters flock to L'Isle-sur-la-Sorgue in Provence,https://www.tripsavvy.com/antique-capital-lisle-sur-la-sorgue-1517798
Top Eurostar Destinations From London,https://www.tripsavvy.com/top-eurostar-destinations-from-london-4069029
France's 43 Different UNESCO World Heritage Sites,https://www.tripsavvy.com/unesco-world-heritage-sites-in-france-3897308
France Has Some Stunning Fortified Medieval Cities to Visit,https://www.tripsavvy.com/fortified-medieval-cities-of-france-4125263
Road Trip! Provence to Tuscany,https://www.tripsavvy.com/provence-to-tuscany-1509023
"Visit the Best Small, Walkable European Cities",https://www.tripsavvy.com/best-small-walkable-cities-in-europe-1508253
