Column1,Column2
Tour of Old Bratislava's Sightseeing Attractions,https://www.tripsavvy.com/bratislava-sights-1501003
Bratislava - Capital City of Slovakia on the Danube River,https://www.tripsavvy.com/bratislava-slovakian-capital-on-danube-river-4119085
October in Eastern Europe: Weather and Event Guide,https://www.tripsavvy.com/eastern-europe-in-october-1501500
Sail Together on a Holiday Viking River Cruise Along the Danube,https://www.tripsavvy.com/the-viking-river-cruise-experience-1862438
"The 10 Best Day Trips From Vienna, Austria",https://www.tripsavvy.com/the-best-day-trips-from-vienna-austria-4163430
Five Eastern European Cities You Probably Missed,https://www.tripsavvy.com/underrate-cities-in-eastern-europe-459812
Eastern European Travel in May: Weather and Event Guide,https://www.tripsavvy.com/eastern-europe-in-may-1501498
Where to Spend Spring Break in Eastern Europe,https://www.tripsavvy.com/spring-break-in-eastern-europe-3150422
Where to Go in Eastern Europe in April,https://www.tripsavvy.com/eastern-europe-in-april-1501490
Guide to the Countries of Eastern Europe,https://www.tripsavvy.com/countries-of-eastern-europe-explored-1501460
Your Guide to September in Eastern Europe: Weather and Events,https://www.tripsavvy.com/eastern-europe-in-september-1501501
Eastern European Travel in July,https://www.tripsavvy.com/eastern-europe-in-july-1501496
