Column1,Column2
"How to Visit Brussels, the Capital of Belgium and the EU",https://www.tripsavvy.com/brussels-travel-guide-1508045
The Top 20 Things to Do in Brussels,https://www.tripsavvy.com/top-things-to-do-in-brussels-4128728
"The Passion of Brussels, Belgium in Pictures",https://www.tripsavvy.com/the-passion-of-brussels-belgium-pictures-4056700
The 9 Best Brussels Hotels of 2019,https://www.tripsavvy.com/best-brussels-hotels-4158106
Exploring How to Get From Brussels to Bruges or Ghent in Belgium,https://www.tripsavvy.com/travel-between-brussels-bruges-ghent-antwerp-1508036
How to Travel From Brussels to Paris: Your Best Options,https://www.tripsavvy.com/travel-from-brussels-to-paris-1618796
Cheap Eats in Brussels,https://www.tripsavvy.com/cheap-eats-in-brussels-1508041
The Best Bars in Brussels,https://www.tripsavvy.com/best-bars-in-brussels-4135467
Travel to Low-Cost Travel Hub South Charleroi Airport From Amsterdam,https://www.tripsavvy.com/amsterdam-to-brussels-south-charleroi-airport-1456437
"Show your support for Brussels during Gay Pride: May 20, 2017",https://www.tripsavvy.com/brussels-gay-pride-1417754
Are Eurostar Trains from London to Europe Better than Flying?,https://www.tripsavvy.com/eurostar-trains-from-london-to-paris-and-brussels-better-than-flying-2250830
Top Eurostar Destinations From London,https://www.tripsavvy.com/top-eurostar-destinations-from-london-4069029
