Column1,Column2
"Pictures of the Top Attractions in Bucharest, the Capital of Romania",https://www.tripsavvy.com/bucharest-capital-of-romania-4119087
Can a Eurail Pass Save You Money in Eastern Europe?,https://www.tripsavvy.com/eurail-pass-in-eastern-europe-3149912
13 European Rivers and Waterways to Cruise,https://www.tripsavvy.com/the-european-rivers-and-waterways-you-can-cruise-4149811
Spare Your Budget With These Cheapest Cities in Eastern Europe,https://www.tripsavvy.com/cheapest-cities-in-eastern-europe-1501450
Explore the Major Cities of Eastern Europe,https://www.tripsavvy.com/major-cities-in-eastern-europe-1501679
Who Says a Eurotrip Can't Be Weird?,https://www.tripsavvy.com/europes-weirdest-cities-and-towns-4093010
Find Your European River Cruise on a Map,https://www.tripsavvy.com/european-river-cruise-maps-4061969
3 Dreamy and Scenic Train Routes in Austria,https://www.tripsavvy.com/beautiful-scenic-train-routes-in-austria-1508938
Find Prague's Location in Europe,https://www.tripsavvy.com/where-is-prague-1502063
A Visual Tour of the Historic Iron Gates on the Danube River,https://www.tripsavvy.com/iron-gates-of-the-danube-river-4061975
TripSavvy Articles on Cruise Travel,https://www.tripsavvy.com/whats-new-at-about-cruises-988672
"Belgrade, Gritty Capital of Serbia, Is on the Rise",https://www.tripsavvy.com/where-is-belgrade-1501176
