Column1,Column2
"Cannes, France - French Riviera Cruise Ship Port of Call",https://www.tripsavvy.com/cannes-french-riviera-port-of-call-4119778
Top Cannes Attractions All Year Round,https://www.tripsavvy.com/top-attractions-in-cannes-1517254
The Guide to the Famous Film Festival,https://www.tripsavvy.com/cannes-film-festival-1516803
St. Paul-de-Vence Cruise Ship Shore Excursion from Nice or Cannes,https://www.tripsavvy.com/st-paul-de-vence-excursion-4062001
The Top Seaside Resorts in France,https://www.tripsavvy.com/top-french-seaside-resorts-1517714
7 Easy Day Trips from Nice,https://www.tripsavvy.com/day-trips-from-nice-1517709
Why You Should Visit France in May,https://www.tripsavvy.com/france-in-may-1517377
The Mediterranean cities from Marseille to Montpellier are fabulous,https://www.tripsavvy.com/from-marseille-to-montpellier-1517513
All you should know about Provence in southern France,https://www.tripsavvy.com/guide-for-provence-southern-france-1517796
Visit the Medieval Village of Eze While Cruising the French Riviera,https://www.tripsavvy.com/eze-medieval-village-on-french-riviera-988780
Films to Watch Before Your Trip to France,https://www.tripsavvy.com/movies-set-in-france-1517332
Top 20 Most Popular French Cities for International Visitors,https://www.tripsavvy.com/popular-french-cities-for-visitors-1517438
