Column1,Column2
Hamburg Travel Guide - 48 Hours in Hamburg,https://www.tripsavvy.com/hamburg-travel-guide-p2-1519851
Guide to Hamburg,https://www.tripsavvy.com/hamburg-travel-guide-1520021
Hamburg set for 2016 Christopher Street Day Gay Pride Aug. 5–7,https://www.tripsavvy.com/hamburg-gay-pride-1417532
The 9 Best Hamburg Hotels of 2019,https://www.tripsavvy.com/the-best-hamburg-hotels-4142288
How to Get from Berlin to Hamburg: 4 Travel Options,https://www.tripsavvy.com/how-to-get-from-berlin-to-hamburg-1519669
Best Museums in Hamburg,https://www.tripsavvy.com/best-museums-in-hamburg-1520024
Hamburg on a Rainy Day,https://www.tripsavvy.com/hamburg-on-a-rainy-day-1520027
What to Do in Hamburg For Free,https://www.tripsavvy.com/hamburg-for-free-1520026
"A Handy Guide to Family Travel to Hamburg, Germany",https://www.tripsavvy.com/traveling-to-hamburg-with-kids-1520028
"Fun Ways to Experience Hamburg, Germany",https://www.tripsavvy.com/top-things-to-do-in-hamburg-1520033
"The Weather and Climate in Hamburg, Germany",https://www.tripsavvy.com/weather-and-climate-in-hamburg-4686123
The Best Restaurants in Hamburg,https://www.tripsavvy.com/best-restaurants-in-hamburg-germany-4705436
