Column1,Column2
"London, England Cruise Pictures",https://www.tripsavvy.com/london-england-cruise-pictures-4069844
Your Guide to Wake Up London's Youth Hostel with Photos,https://www.tripsavvy.com/wake-up-london-hostel-review-with-photos-3150068
A Guide to Airports in London,https://www.tripsavvy.com/guide-to-airports-in-london-4582957
"The One-Name Superstars Stay at Corinthia Hotel London. Yep, Them",https://www.tripsavvy.com/corinthia-hotel-london-five-star-luxury-2251031
Stay Close to London and Stay Cheaper,https://www.tripsavvy.com/save-money-and-stay-outside-london-4120696
"When in London, Seeing the Tower of London Is a Must",https://www.tripsavvy.com/tower-of-london-1583694
World's First Grand Hotel Keeps Its Cool: Langham London,https://www.tripsavvy.com/langham-london-hotel-2251087
Find out about Pancake Day in London,https://www.tripsavvy.com/pancake-day-in-london-1582556
Budget London for Senior Travelers,https://www.tripsavvy.com/budget-london-for-senior-travelers-2972698
15 Fantastic and Easy Day Trips From London,https://www.tripsavvy.com/terrific-day-trips-from-london-1662322
Top Tips for a Budget Whirlwind London Layover,https://www.tripsavvy.com/enjoy-a-london-layover-459804
"Your Handy Guide to the London Tube: Maps, Tips, and Advice",https://www.tripsavvy.com/guide-to-the-london-tube-3150556
