Column1,Column2
"Oslo, Norway Pictures",https://www.tripsavvy.com/oslo-norway-pictures-4069816
"A City Profile of Oslo, Norway",https://www.tripsavvy.com/oslo-norway-city-profile-1626116
Check out These Day Trips From Norway,https://www.tripsavvy.com/best-day-trips-from-oslo-1626124
"How to Spend a 1, 3 or 7 days in Oslo, Norway",https://www.tripsavvy.com/1-3-or-7-days-in-oslo-norway-1626123
The 9 Best Oslo Hotels of 2019,https://www.tripsavvy.com/the-best-oslo-hotels-4143352
10 Places Couples Shouldn't Miss Seeing on a Romantic Visit to Oslo,https://www.tripsavvy.com/romantic-attractions-in-oslo-norway-1861831
Traveling From Oslo to Trondheim in Norway,https://www.tripsavvy.com/how-to-get-from-oslo-to-trondheim-1626278
"The Best Guided Tours in Oslo, Norway",https://www.tripsavvy.com/best-guided-tours-in-oslo-norway-1626126
Oslo 2016 Gay Pride is set for June 17 through June 26,https://www.tripsavvy.com/oslo-norway-gay-pride-4019612
A List of the 8 Best Budget Hotels in Oslo in 2019,https://www.tripsavvy.com/best-cheap-hotels-in-oslo-norway-1626637
"How to Get From Stockholm, Sweden, to Oslo, Norway",https://www.tripsavvy.com/how-to-get-from-stockholm-to-oslo-1626282
How to Travel Between Oslo and Stavanger in Norway,https://www.tripsavvy.com/how-to-get-from-oslo-to-stavanger-1626277
