Column1,Column2
"Palma de Mallorca, Capital City of Mallorca in the Balearic Islands",https://www.tripsavvy.com/palma-de-mallorca-balearic-islands-4119774
Three Things to Do on the Island of Mallorca,https://www.tripsavvy.com/palma-de-mallorca-shore-excursions-988794
Mallorca - Mediterranean Playground,https://www.tripsavvy.com/mallorca-majorca-mediterranean-port-of-call-988791
How to pronounce and spell some common places in Spanish and English,https://www.tripsavvy.com/frequently-mispronounced-places-in-spain-1643638
Explore the Mediterranean on a Cruise Ship,https://www.tripsavvy.com/carnival-breeze-mediterranean-cruise-travel-journal-991178
Discover big outdoor adventures in Mallorca,https://www.tripsavvy.com/adventurous-things-to-do-in-majorca-4102841
Where to Find the US Embassy and Consulates in Spain,https://www.tripsavvy.com/us-embassy-and-consulates-in-spain-1644063
Wind Surf Photo Gallery,https://www.tripsavvy.com/wind-surf-photo-gallery-4069839
"Essential Facts About Spain: Geography, Culture and More",https://www.tripsavvy.com/essential-facts-about-spain-1643208
Cruise as Cool as Tom: The Mediterranean on a Star Clippers Tall Ship,https://www.tripsavvy.com/tall-ship-cruise-aboard-star-clippers-4080567
Carnival Breeze Outdoors,https://www.tripsavvy.com/carnival-breeze-outdoors-4117884
The 7 Best Mediterranean Cruises of 2019,https://www.tripsavvy.com/best-mediterranean-cruises-4690894
