Column1,Column2
Moscow - Russian Rivers and Waterways Port of Call,https://www.tripsavvy.com/moscow-russian-rivers-port-of-call-4069833
50 Things to Do in Moscow,https://www.tripsavvy.com/things-to-do-in-moscow-1501845
"Vodka, Dolls, and Onion Domes on a Russian River Cruise",https://www.tripsavvy.com/viking-river-cruises-russian-waterways-993054
Making Sense of Moscow's Manic Metro,https://www.tripsavvy.com/complete-guide-to-the-moscow-metro-4589882
Moscow Winter Festivals and Activities,https://www.tripsavvy.com/winter-in-moscow-things-to-do-1501858
Want to Visit Moscow in June? Starts Here,https://www.tripsavvy.com/moscow-june-weather-and-event-guide-4685449
"Why Is Moscow, Capital of Russia, Called the City of Domes?",https://www.tripsavvy.com/moscow-capital-city-of-russia-1501835
These Examples of Stalinist Architecture are Really Over-the-Top,https://www.tripsavvy.com/photos-of-stalins-seven-sisters-in-moscow-1501848
The Top 9 Bars and Pubs in Moscow,https://www.tripsavvy.com/top-bars-and-pubs-in-moscow-1622465
10 Things to See in Moscow's Red Square,https://www.tripsavvy.com/moscows-red-square-the-complete-guide-4161124
Moscow's Most Famous Sites and Attractions,https://www.tripsavvy.com/moscow-must-see-sights-1502282
Explore the Relics of the Soviet Union in Moscow,https://www.tripsavvy.com/soviet-sights-in-moscow-1622455
