Column1,Column2
Here's the Perfect Itinerary for a Whirlwind 3 Days in Rome,https://www.tripsavvy.com/3-day-rome-itinerary-1547883
"The 25 Top Attractions in Rome, Italy",https://www.tripsavvy.com/top-rome-tourist-attractions-1547860
How to Use Rome's Public Transport System,https://www.tripsavvy.com/how-to-use-rome-s-public-transport-system-4582443
Your Trip to Rome: The Complete Guide,https://www.tripsavvy.com/rome-travel-guide-and-attractions-1547874
The 9 Best Rome Tours of 2019,https://www.tripsavvy.com/best-tours-in-rome-4171545
10 Helpful Travel Books for Your Rome Vacation,https://www.tripsavvy.com/top-travel-guides-for-rome-1547889
Don't Miss Visiting These Essential Ancient Sites in Rome,https://www.tripsavvy.com/top-ancient-sites-in-rome-1547885
Month-By-Month Guide to Events in Rome,https://www.tripsavvy.com/rome-events-calendar-1547110
Rome Nightlife Guide: The Best Bars & Clubs,https://www.tripsavvy.com/nightlife-in-rome-best-bars-and-clubs-4584371
The Best Time to Visit Rome,https://www.tripsavvy.com/best-time-to-visit-rome-1547870
Find the Best Places to Stay in Rome,https://www.tripsavvy.com/where-to-stay-in-rome-1547447
11 Beautiful Churches You Have to Visit in Rome,https://www.tripsavvy.com/top-churches-in-rome-1547888
